{
  "entityid": "",
  "state": "testaccepted",
  "allowedall": true,
  "allowedEntities": [],
  "disableConsent": [],
  "metaDataFields": {
    "name:en": "OpenConext Valid IDP EN",
    "SingleSignOnService:0:Binding": "urn:oasis:names:tc:SAML:2.0:bindings:HTTP-Redirect",
    "SingleSignOnService:0:Location": ""
  }
}